{
  "rig": "6",
  "component": "intel-arc-pro-b70",
  "componentQuantity": 1,
  "model": "qwen3-8-27b",
  "quant": "q4_k_m",
  "runtime": "llamacpp",
  "runtimeVersion": "SYCL 0.3.0-dev 1692f9e50 (build 361)",
  "runtimeFlags": "-fa 1, -ngl 99, -b 8192, -ub 4096, KV q8_0 K / q4_1 V, no speculative decode",
  "decodeTps": 20.01,
  "promptTps": 611.73,
  "contextLength": 8192,
  "batchSize": 1,
  "runDate": "2026-09-14",
  "notes": "Dense 27B hybrid-attention (GDN). llama-bench engine-native tg128 at p512, mean of 5 repetitions (raw emitted repetition data); engine-native timing, not client-observed streaming. promptTps is llama-bench engine-native pp512 from the same repetitions, not the HTTP cold-input rate. No speculative decode; the same GGUF family with native draft-MTP reaches ~38 tok/s at this cell (n=3 screen, not submitted as representative). Q4_K_M 16.81 GB freshly quantized from the SHA-verified BF16 release (not a third-party quant); decode is cap-insensitive (15.2 tok/s at both 150 W and 230 W on the Q8_0 arm). Single card of a 2x B70 rig. Configured cap 150 W. Correctness: coherent-output smoke plus llama-quantize perplexity arms. Evidence: cookbook docs/qwen38-27b/QUANT-FORMAT-SHOWDOWN-B70.md (commit 22bd3253). Self-reported, E2."
}
